{
    "$schema": "schema/circuit-schema.json",
    "name": "Sardegna",
    "variationName": "Sardegna - Road Track - C",
    "default": false,
    "country": "it",
    "lengthMetres": 2637,
    "lastModified": "2025-09-23T13:50:58Z",
    "coordinates": {
        "circuit": [
            { "x": -398.88968, "y": 8.646052, "z": 207.7865 },
            { "x": -399.01608, "y": 8.648822, "z": 208.7987 },
            { "x": -399.14246, "y": 8.651315, "z": 209.81151 },
            { "x": -399.26874, "y": 8.653591, "z": 210.82492 },
            { "x": -399.39505, "y": 8.655655, "z": 211.83902 },
            { "x": -399.52124, "y": 8.657535, "z": 212.85379 },
            { "x": -399.64746, "y": 8.659352, "z": 213.86928 },
            { "x": -399.77362, "y": 8.660933, "z": 214.88544 },
            { "x": -399.89975, "y": 8.662348, "z": 215.90231 },
            { "x": -400.02576, "y": 8.663622, "z": 216.91989 },
            { "x": -400.15167, "y": 8.664797, "z": 217.93817 },
            { "x": -400.2776, "y": 8.665887, "z": 218.95717 },
            { "x": -400.40338, "y": 8.666979, "z": 219.9769 },
            { "x": -400.5291, "y": 8.668124, "z": 220.9973 },
            { "x": -400.65482, "y": 8.669276, "z": 222.01843 },
            { "x": -400.7804, "y": 8.670329, "z": 223.04016 },
            { "x": -400.906, "y": 8.671292, "z": 224.06256 },
            { "x": -401.03156, "y": 8.672038, "z": 225.08556 },
            { "x": -401.157, "y": 8.67231, "z": 226.1091 },
            { "x": -401.28247, "y": 8.671994, "z": 227.13322 },
            { "x": -401.4079, "y": 8.67114, "z": 228.15793 },
            { "x": -401.53317, "y": 8.669563, "z": 229.18321 },
            { "x": -401.65848, "y": 8.667394, "z": 230.20915 },
            { "x": -401.78372, "y": 8.664657, "z": 231.23575 },
            { "x": -401.9089, "y": 8.661582, "z": 232.26312 },
            { "x": -402.03412, "y": 8.658183, "z": 233.2912 },
            { "x": -402.15933, "y": 8.654891, "z": 234.32011 },
            { "x": -402.28455, "y": 8.651856, "z": 235.34985 },
            { "x": -402.4097, "y": 8.649304, "z": 236.38043 },
            { "x": -402.53488, "y": 8.647364, "z": 237.41182 },
            { "x": -402.65997, "y": 8.64603, "z": 238.44392 },
            { "x": -402.78503, "y": 8.6452675, "z": 239.47673 },
            { "x": -402.91006, "y": 8.64499, "z": 240.51016 },
            { "x": -403.03506, "y": 8.645052, "z": 241.54416 },
            { "x": -403.16, "y": 8.645076, "z": 242.57867 },
            { "x": -403.2849, "y": 8.644929, "z": 243.61366 },
            { "x": -403.4099, "y": 8.644409, "z": 244.64914 },
            { "x": -403.5349, "y": 8.643343, "z": 245.68509 },
            { "x": -403.65988, "y": 8.641424, "z": 246.72157 },
            { "x": -403.78482, "y": 8.638734, "z": 247.75854 },
            { "x": -403.9098, "y": 8.635172, "z": 248.7961 },
            { "x": -404.03467, "y": 8.630873, "z": 249.83426 },
            { "x": -404.15952, "y": 8.626184, "z": 250.8732 },
            { "x": -404.28433, "y": 8.621257, "z": 251.91292 },
            { "x": -404.40918, "y": 8.616376, "z": 252.9535 },
            { "x": -404.53397, "y": 8.611654, "z": 253.9949 },
            { "x": -404.65884, "y": 8.607312, "z": 255.03714 },
            { "x": -404.78375, "y": 8.60341, "z": 256.08014 },
            { "x": -404.9087, "y": 8.600095, "z": 257.12387 },
            { "x": -405.0337, "y": 8.597217, "z": 258.16824 },
            { "x": -405.15872, "y": 8.594709, "z": 259.21323 },
            { "x": -405.2838, "y": 8.592468, "z": 260.25873 },
            { "x": -405.4089, "y": 8.590472, "z": 261.3048 },
            { "x": -405.5341, "y": 8.588665, "z": 262.35144 },
            { "x": -405.65936, "y": 8.58706, "z": 263.39865 },
            { "x": -405.78464, "y": 8.585672, "z": 264.44647 },
            { "x": -405.9099, "y": 8.584553, "z": 265.4949 },
            { "x": -406.03528, "y": 8.583883, "z": 266.54398 },
            { "x": -406.16064, "y": 8.583637, "z": 267.59372 },
            { "x": -406.28607, "y": 8.58396, "z": 268.64413 },
            { "x": -406.4116, "y": 8.584767, "z": 269.69516 },
            { "x": -406.53717, "y": 8.585908, "z": 270.74677 },
            { "x": -406.66275, "y": 8.587283, "z": 271.7989 },
            { "x": -406.78842, "y": 8.588674, "z": 272.85153 },
            { "x": -406.91412, "y": 8.589999, "z": 273.9047 },
            { "x": -407.03986, "y": 8.59128, "z": 274.95837 },
            { "x": -407.1657, "y": 8.592348, "z": 276.0126 },
            { "x": -407.29163, "y": 8.593212, "z": 277.06738 },
            { "x": -407.4176, "y": 8.594291, "z": 278.12283 },
            { "x": -407.54367, "y": 8.595596, "z": 279.17896 },
            { "x": -407.66986, "y": 8.597315, "z": 280.23578 },
            { "x": -407.79614, "y": 8.599493, "z": 281.29333 },
            { "x": -407.92252, "y": 8.60216, "z": 282.35156 },
            { "x": -408.04898, "y": 8.6051655, "z": 283.41034 },
            { "x": -408.17554, "y": 8.608553, "z": 284.46967 },
            { "x": -408.30212, "y": 8.612009, "z": 285.5295 },
            { "x": -408.42883, "y": 8.615282, "z": 286.58975 },
            { "x": -408.5556, "y": 8.618361, "z": 287.65048 },
            { "x": -408.68246, "y": 8.620944, "z": 288.71164 },
            { "x": -408.80948, "y": 8.623229, "z": 289.7733 },
            { "x": -408.93658, "y": 8.625348, "z": 290.83554 },
            { "x": -409.0639, "y": 8.627372, "z": 291.89838 },
            { "x": -409.19147, "y": 8.629511, "z": 292.9619 },
            { "x": -409.31912, "y": 8.631696, "z": 294.02606 },
            { "x": -409.44696, "y": 8.633952, "z": 295.09085 },
            { "x": -409.57492, "y": 8.636173, "z": 296.15616 },
            { "x": -409.70306, "y": 8.638347, "z": 297.22214 },
            { "x": -409.83124, "y": 8.640402, "z": 298.28857 },
            { "x": -409.95956, "y": 8.642369, "z": 299.3556 },
            { "x": -410.08792, "y": 8.644228, "z": 300.42313 },
            { "x": -410.21646, "y": 8.646253, "z": 301.49127 },
            { "x": -410.34515, "y": 8.648586, "z": 302.56003 },
            { "x": -410.474, "y": 8.651359, "z": 303.62943 },
            { "x": -410.6031, "y": 8.654812, "z": 304.6995 },
            { "x": -410.73242, "y": 8.6593685, "z": 305.7702 },
            { "x": -410.86194, "y": 8.665175, "z": 306.84158 },
            { "x": -410.99176, "y": 8.6722355, "z": 307.91357 },
            { "x": -411.12183, "y": 8.680544, "z": 308.98608 },
            { "x": -411.2521, "y": 8.690451, "z": 310.05914 },
            { "x": -411.3825, "y": 8.701575, "z": 311.1327 },
            { "x": -411.51312, "y": 8.713748, "z": 312.2066 },
            { "x": -411.64383, "y": 8.726739, "z": 313.2809 },
            { "x": -411.77466, "y": 8.740416, "z": 314.35565 },
            { "x": -411.90567, "y": 8.754261, "z": 315.4307 },
            { "x": -412.03687, "y": 8.768354, "z": 316.50613 },
            { "x": -412.16815, "y": 8.782618, "z": 317.582 },
            { "x": -412.29974, "y": 8.797122, "z": 318.65836 },
            { "x": -412.43146, "y": 8.811667, "z": 319.73514 },
            { "x": -412.56345, "y": 8.826455, "z": 320.81247 },
            { "x": -412.69565, "y": 8.841993, "z": 321.89035 },
            { "x": -412.82806, "y": 8.858355, "z": 322.96884 },
            { "x": -412.9607, "y": 8.875773, "z": 324.04794 },
            { "x": -413.09357, "y": 8.894478, "z": 325.1277 },
            { "x": -413.2267, "y": 8.914699, "z": 326.2079 },
            { "x": -413.36002, "y": 8.93612, "z": 327.28867 },
            { "x": -413.4936, "y": 8.958849, "z": 328.36987 },
            { "x": -413.62738, "y": 8.982502, "z": 329.45145 },
            { "x": -413.76144, "y": 9.006875, "z": 330.53336 },
            { "x": -413.8957, "y": 9.031504, "z": 331.61554 },
            { "x": -414.0302, "y": 9.056208, "z": 332.69803 },
            { "x": -414.16492, "y": 9.080825, "z": 333.78088 },
            { "x": -414.29987, "y": 9.105259, "z": 334.86407 },
            { "x": -414.43497, "y": 9.129452, "z": 335.9477 },
            { "x": -414.57037, "y": 9.153485, "z": 337.0318 },
            { "x": -414.706, "y": 9.177729, "z": 338.11646 },
            { "x": -414.84186, "y": 9.202127, "z": 339.20163 },
            { "x": -414.97803, "y": 9.227209, "z": 340.2875 },
            { "x": -415.11435, "y": 9.253082, "z": 341.37387 },
            { "x": -415.25104, "y": 9.279999, "z": 342.46082 },
            { "x": -415.38782, "y": 9.307923, "z": 343.5483 },
            { "x": -415.52496, "y": 9.337008, "z": 344.63626 },
            { "x": -415.6623, "y": 9.367636, "z": 345.72467 },
            { "x": -415.79977, "y": 9.399714, "z": 346.81354 },
            { "x": -415.9375, "y": 9.433028, "z": 347.90277 },
            { "x": -416.07544, "y": 9.467538, "z": 348.99225 },
            { "x": -416.21356, "y": 9.503014, "z": 350.08197 },
            { "x": -416.35184, "y": 9.538846, "z": 351.17194 },
            { "x": -416.49042, "y": 9.574865, "z": 352.2621 },
            { "x": -416.6291, "y": 9.610666, "z": 353.35245 },
            { "x": -416.768, "y": 9.646057, "z": 354.44308 },
            { "x": -416.9071, "y": 9.680805, "z": 355.53403 },
            { "x": -417.04642, "y": 9.71498, "z": 356.62534 },
            { "x": -417.18588, "y": 9.748998, "z": 357.7172 },
            { "x": -417.32556, "y": 9.783004, "z": 358.80957 },
            { "x": -417.46548, "y": 9.817428, "z": 359.90262 },
            { "x": -417.60568, "y": 9.852619, "z": 360.99628 },
            { "x": -417.74606, "y": 9.88899, "z": 362.09055 },
            { "x": -417.88657, "y": 9.92642, "z": 363.18536 },
            { "x": -418.02734, "y": 9.965323, "z": 364.2807 },
            { "x": -418.16827, "y": 10.005478, "z": 365.37643 },
            { "x": -418.30945, "y": 10.046783, "z": 366.4724 },
            { "x": -418.4507, "y": 10.08902, "z": 367.56866 },
            { "x": -418.5921, "y": 10.132004, "z": 368.66516 },